{
  "chapter_id": "chapter-0001",
  "artifact_kind": "draft",
  "artifact_sha256": "12317eb7338facd6f1abae677c8bcf5043e152dec9c1788afbf1c55657f9b350",
  "context_sha256": "7b21c456995262928d2f975021def922c6c30e0a0661e4d318ff292460787d2f",
  "verdict": "ACCEPT_WITH_WARNINGS",
  "dimensions": {
    "canon": [
      "The draft strictly adheres to the rule of character_lu_chenyuan being at the 燃命境初成 stage, limiting his ability to basic sensory mismatch detection.",
      "No forbidden assets or advanced capabilities (like chain tracing or ledger covenants) are introduced or activated.",
      "The Shou Jisi (寿籍司) operates strictly within its local registration and verification authority."
    ],
    "character": [
      "Su Wan behaves consistently with her moral constraint, explicitly refusing to take life fire from neighbors to prolong her own life.",
      "Lu Chenyuan's role as a half-life scribe under bureaucratic and familial pressure is established effectively.",
      "Qiu Shen acts as a self-preserving executor who values procedural compliance over unnecessary cruelty, agreeing to 'postpone' under rules rather than reacting as a generic villain."
    ],
    "state": [
      "Physical consequences of Lu Chenyuan's sight usage (burning eyes, darkening lines) are depicted sensory-first without database terminology.",
      "Su Wan's failing life is represented via cold ash odor, cold palms, and cracks on her lamp.",
      "The falling tile and gray rain directly interact with the environment, shrinking the remnants of the protective array."
    ],
    "causality": [
      "The plot flows logically: the discrepancy in the ledger forces Lu Chenyuan to act; the falling tile's ash marks Gu Shen's arm in real-time, providing the bureaucratic loophole needed to justify a postponement.",
      "The threat is deferred rather than solved, maintaining the core tension of the chapter."
    ],
    "pacing": [
      "The transition from the intimate home setting to the cold, hostile alley is well-paced, using the copper ruler sounds as a narrative bridge.",
      "The confrontation at the alley mouth builds suspense effectively through silent community solidarity and bureaucratic pressure."
    ],
    "life_force": [
      "The description of Mudlamp Lane under gray rain feels vivid and atmospheric ('like cold ash from an old stove').",
      "The silent mutual aid (moving lamps inside, leaving hot water at Gu's door) builds a rich, believable community."
    ],
    "anti_ai_taste": [
      "Exposition is entirely sensory rather than abstract, avoiding high-level commentary on '命运' or '意义'.",
      "Extremely low frequency of typical AI transition words ('然而', '与此同时') and rhetorical patterns, maintaining a clean literary voice."
    ],
    "originality": [
      "The life-fire ledger system is integrated smoothly, avoiding generic cultivation cliches.",
      "The conflict resolution is bureaucratic and rule-based rather than relying on physical combat or sudden power awakening."
    ]
  },
  "issues": [
    {
      "issue_id": "chapter-0001-minor-starter-repetition",
      "severity": "minor",
      "evidence": "The character name '陆沉渊' starts sentences 12 times, and '苏晚' starts sentences 8 times, leading to a slight repetition in prose flow as flagged by the metrics.",
      "required_fix": "In subsequent chapters, vary sentence structures so character names do not repeatedly initiate actions."
    },
    {
      "issue_id": "chapter-0001-minor-exposure-visibility",
      "severity": "minor",
      "evidence": "The draft shows Lu Chenyuan's eye line darkening in public ('眼角那线焦黑再也藏不住'), which is noticed by Qiu Shen.",
      "required_fix": "Ensure the subsequent state settlement accurately registers the increase in half_life_registry_exposure and sanity_level strain resulting from this public display."
    }
  ]
}
