{
  "chapter_id": "chapter-0001",
  "artifact_kind": "revision",
  "artifact_sha256": "79d46dc564388fc32d8bae5b8fdc5ebd7a3dc2412e2174f8558844cad1fda874",
  "context_sha256": "7b21c456995262928d2f975021def922c6c30e0a0661e4d318ff292460787d2f",
  "verdict": "ACCEPT_WITH_WARNINGS",
  "dimensions": {
    "canon": [
      "陆沉渊固定在燃命境初成，全章仅使用普通寿痕辨识与本地灰痕错位识别，未触及识账境、余烬回照或锁链偏转等高阶能力。",
      "残命灯盏、古债契约、府级转运、黑市交易等休眠资产在文本中完全缺席。",
      "母亲寿命债作为持续约束呈现，未被即时解决或减免。",
      "灰烬异痕仅作为可见本地线索出现（册页灰屑与骨上红印），未揭示古债来源或府级真相。"
    ],
    "character": [
      "陆沉渊以掩饰反噬、谨慎博弈的方式行事，符合半寿残籍抄录者的受压起点定位。",
      "苏晚是清醒的行动者：主动检查儿子伤痕、以明确拒绝（不许借他人灯火）限制主角，而非被动等待牺牲。",
      "仇慎以程序性施压与冷淡的观察者姿态出场，未被写成脸谱化恶人；其最终'暂缓'决定符合自保逻辑而非善意洗白。",
      "顾婶的恳求通过压住孩子、抓紧门框等身体细节呈现，没有沦为工具化受害者。"
    ],
    "state": [
      "observation.json 记录的 eye_pattern_burn 加重与文中'眼角焦黑再也藏不住'一致，属承压账本的合法感官显形。",
      "全章未写入 sanity_level、half_life_registry_exposure、mother_life_lamp_cracks、mudlamp_array_integrity 或 resident_lifefire_reserve 的数值变动——仅描写了灯壁裂纹和阵纹缩光等感官征兆，不构成状态账本改写。",
      "无不可逆状态转换、战斗结算、命器获取或寿债清偿发生。"
    ],
    "causality": [
      "灰痕识别→眼角焦纹加重→仇慎察觉焦纹→暴露风险升高：因果链连贯且方向一致。",
      "陆沉渊以'旧例程序瑕疵'包装灰痕发现，回避直接展示识账能力，与其半寿身份的隐蔽需求吻合。",
      "仇慎的'暂缓'决定由册面脏痕提供了程序借口，并非无缘由的仁慈。",
      "顾婶骨上印与册页灰屑同步出现但未被因果串联，保留了谜团空间而非强行解释。"
    ],
    "pacing": [
      "全章收束在清晨到寿籍司离巷的单一时间段内，叙事焦点不离泥灯巷，节奏由家庭→巷道→对峙→短暂喘息自然推进。",
      "没有出现战力爆发、升级跳跃或场景快切，符合建立受压起点的意图。",
      "结尾收在'雨仍在下'的未解状态，暗示午后复核的悬而未决，留出下章推进空间。"
    ],
    "life_force": [
      "感官描写密度高且多通道交叉：冷水入骨、灰味入丝缕、焦纹灼眼、冷灰沾喉，形成身体在场感。",
      "邻里反应以极度克制的方式呈现——悄悄移灯、不露手递热水、无人道谢——传达出贫城互保的共同体质感。",
      "苏晚与陆沉渊的母子对话用拒绝和沉默推进张力，而非抒情独白。"
    ],
    "anti_ai_taste": [
      "情感传递通过物理细节完成（攥药包、灶水凉透、碗沿泼水），全章无'他感到矛盾''他心中涌起复杂情绪'等概括性内心说明。",
      "对白短促、带有省略和打断，符合受压者不敢把话说完的生存状态。",
      "仇慎的威胁以暗语式单句交付（'眼睛不好便少看些不该看的东西'），没有反派宣言式自我解释。",
      "轻微注意：中段灰痕辨认一节连续使用四个比喻（火屑/针扎/井底石苔/烧剩笔尖），密度偏高，可能略显匠气。"
    ],
    "originality": [
      "命灯、寿痕、折记、冷金印片、灰雨、护阵旧纹等世界语汇均为本项目原创体系，未借用任何既有作品的专有名词或升级路径。",
      "场景结构（半寿抄录吏在自家贫巷面对命籍核验官）不复制常见的宗门考核、宗师下山或废柴逆袭开局模板。",
      "母亲苏晚以'替我把门关上'的道德底线对话构建约束，而非以秘境遗产或隐藏血脉推动叙事。"
    ]
  },
  "issues": [
    {
      "issue_id": "chapter-0001-minor-image-density",
      "severity": "minor",
      "evidence": "revision.md 第147-159行的灰痕辨认段落在12行内连续使用火屑、针扎、井底石苔、烧剩笔尖四个比喻意象，意象密度偏高。",
      "required_fix": "后续修订或章节将该段精简至两到三个核心意象，保持感官锐度并降低匠气感。"
    },
    {
      "issue_id": "chapter-0001-minor-clue-density",
      "severity": "minor",
      "evidence": "revision.md 第189-196行在短篇幅内同步呈现顾婶骨上红印、册页灰屑和阵纹暖光缩退三条感官线索，信息密度略高于周围段落。",
      "required_fix": "后续修订或章节让册页灰与骨印先形成锚点，再延后一两拍引入阵纹缩退。"
    }
  ]
}
