{
  "chapter_id": "chapter-0004",
  "artifact_kind": "draft",
  "artifact_sha256": "0829554f4c08b74322d9e8cf44cdb7c9164e86f9bc5026b61874807bd16fecb3",
  "context_sha256": "65a8bf61104cfa25dfc2014d94f290aea7569588c654883bc378a26688f135d3",
  "verdict": "ACCEPT_WITH_WARNINGS",
  "dimensions": {
    "canon": [
      "陆沉渊的修为表现严格限定在燃命境初成，仅使用普通识账辨认巷口泥灯座裂缝灰痕与命籍衙印记折转，无任何越级或违规法术行为。",
      "残命灯盏未被提及或使用，州府命库仅作为远端警告压力，均符合大纲与设定集限制。",
      "故事完全局限在贫城泥灯巷的局部程序冲突范围内，没有违规换图或势力越级展露。"
    ],
    "character": [
      "陆沉渊坚持‘不替任何人说没看见的事’的底线，体现了他在沉重压力下求真与保护居民自愿原则的平衡，抄录吏定位准确。",
      "苏晚坚决拒绝用邻里命火填补裂纹，体现了其强烈的道德自主性，并非被动消耗的道具。",
      "莫井兰和顾婶各自对口述范围进行限定（莫井兰拒绝交出陶片及签字，顾婶拒绝让孩童受验），展现了泥灯巷住户极具真实感的自卫性选择与共同体博弈逻辑。",
      "仇慎在门外推纸传话并施加程序性威胁（无证护阵），保持了基层官吏自我免责、按规施压的防卫性特征。"
    ],
    "state": [
      "识账术的反噬（眼尾焦纹下延、眼痛掉黑屑、咳冷灰、掌骨摩擦声）在正文中通过强烈的感官细节予以显形，无任何游戏化或工程化词汇。",
      "苏晚的手背红痕裂开渗冷光、手腕失温以及泥灯座开裂等细节，生动呈现了命灯与阵纹受损的物理状态。"
    ],
    "causality": [
      "陆沉渊辨认泥灯座裂缝处的冷灰空白，从而咳嗽冷灰，冷灰落在泥地上；后半夜仇慎推入通知薄纸时，纸背正好沾上这部分冷灰，避开衙印，形成了极佳的物理因果嵌套。",
      "苏晚和莫井兰对作证边界的限定直接导致了对明日辰时复核的防守策略，推进了与命籍衙的程序性拉锯。"
    ],
    "pacing": [
      "场景严格限定在夜间的泥灯巷，环境局限且时间顺延，氛围内聚、压抑而凝练。",
      "结尾只推进到明日辰时的护阵旁观复核，危机并未解除而是作为延期悬念保留，节奏控制得当。"
    ],
    "life_force": [
      "细雨后的黑点灯罩、井泥般冰冷的冷灰、缠了三圈系不紧的麻线等描写，提供了强烈的质感与市井烟火气。",
      "住户们在黑暗中隔门发声、借半夜命火被喝止、关门留缝等细节，生动勾勒出泥灯巷居民在恐惧与善意间的挣扎与克制。"
    ],
    "anti_ai_taste": [
      "避开了抽象的抒情与概括性的心理解析，所有情感波动均通过身体动作、物理道具及台词留白传递。",
      "没有大段的反派宣章或主角自白，对白极具市井拉锯的精细质感。"
    ],
    "originality": [
      "围绕“寿印、残籍、咳灰、无证护阵”等核心概念进行精细的程序性博弈，避免了常规玄幻斗法与拯救苍生的降智套路，具有极高的原创度与质感。"
    ]
  },
  "issues": [
    {
      "issue_id": "chapter-0004-minor-starter-repetition",
      "severity": "minor",
      "evidence": "正文度量指标中 sentence_opening_repetition 被标记，其中‘”\\n’（对话结束换段）出现次数较多，且‘陆沉渊’（8次）、‘苏晚’（7次）等角色名作为句首词频次稍高。",
      "required_fix": "在后续章节中注意调整句式，减少角色名字起句的频率，优化段落开头的视觉排布。"
    },
    {
      "issue_id": "chapter-0004-state-sanity-decrement-missing",
      "severity": "minor",
      "evidence": "根据 chapter-0004 的 context.json，识账术（technique_ledger_recognition）每次施展需扣减 0.08 的 sanity_level，但 observation.json 中未登记此数值变化。",
      "required_fix": "在后续状态结算（settlement.json）中，将陆沉渊的 sanity_level 从 0.64 扣减至 0.56，并确保在 physical_state 账目中进行一致性登记。"
    }
  ]
}
