{
  "chapter_id": "chapter-0044",
  "artifact_kind": "revision",
  "artifact_sha256": "709282aa3890309e0e7e673d35400bec5a1c811562e250be8fa5cacef71bcb66",
  "context_sha256": "e1b765a382edd10635536176cc05912824f043618c875d4bfd017f087aa3fe45",
  "verdict": "ACCEPT_WITH_WARNINGS",
  "dimensions": {
    "canon": [
      "hash-bound context retained"
    ],
    "character": [
      "state observation remains mandatory"
    ],
    "state": [
      "final observation and settlement remain mandatory"
    ],
    "causality": [
      "story-window irreversible change is bound in context"
    ],
    "pacing": [
      "paragraphs=95"
    ],
    "life_force": [
      "sensory_hits=84"
    ],
    "anti_ai_taste": [
      "sentence_opening_repetition"
    ],
    "originality": [
      "no raw corpus is available to the chapter writer"
    ]
  },
  "issues": [
    {
      "issue_id": "metric-01-sentence_opening_repetition",
      "severity": "minor",
      "evidence": "deterministic prose metric flagged sentence_opening_repetition",
      "required_fix": "Vary sentence subjects and entry points without changing facts."
    }
  ]
}
