{
  "chapter_id": "chapter-0012",
  "artifact_kind": "draft",
  "artifact_sha256": "528113bc12497079e01c4587d3cf4a9852fe4730220e28dca98cc3a70557051b",
  "context_sha256": "d3cf994ef9074a6590258d5355819a0d4004db212ee5cff039112ddc4dc0fe01",
  "verdict": "ACCEPT",
  "dimensions": {
    "canon": [],
    "character": [],
    "state": [],
    "causality": [],
    "pacing": [],
    "life_force": [],
    "anti_ai_taste": [],
    "originality": []
  },
  "issues": []
}
