{
  "chapter_id": "chapter-0008",
  "artifact_kind": "draft",
  "artifact_sha256": "679f83c3313973f15f8fc6f6c6f635df836ee40538cf248fd4beb48f06e9cb4f",
  "context_sha256": "d4b213d6ef68e925f8b6f68f264a01d7e9c7c72ee874b1b658cc518815c04c9e",
  "verdict": "ACCEPT",
  "dimensions": {
    "canon": [],
    "character": [],
    "state": [],
    "causality": [],
    "pacing": [],
    "life_force": [],
    "anti_ai_taste": [],
    "originality": []
  },
  "issues": []
}
